{
  "context": {
    "task_id": "task_real_domain_active",
    "run_id": "run_real_domain_active",
    "operator": "operator",
    "workspace": "default",
    "authorization_scope": "placeholder:p7-disabled"
  },
  "target": {
    "type": "domain",
    "value": "example.test",
    "metadata": {
      "p5_6_status": "disabled-future"
    }
  },
  "options": {
    "mode": "dry_run",
    "passive": {
      "enabled": false,
      "sources": [],
      "crtsh_enabled": false,
      "crtsh_timeout_seconds": 10
    },
    "active": {
      "enabled": false,
      "dry_run": true,
      "wordlist_file": "examples/wordlist.small.txt",
      "resolvers": [],
      "record_types": ["A", "AAAA"],
      "timeout_seconds": 3,
      "concurrency": 5,
      "rate_limit_per_second": 5,
      "max_candidates": 100,
      "detect_wildcard": true
    },
    "output": {
      "include_unresolved": false,
      "include_sources": true
    }
  },
  "policy": {
    "allow_active_verify": false,
    "allow_high_risk": false
  }
}
